{"abi":"zryna-native-c-interop-v0","carriers":"native-c-interop-v0-carriers","convention":"sysv-amd64-c-v0","format":"zryna.native-c-declarations.v0","libraries":[{"allocators":[{"category":"bytes","create":"fixture-c-v0@0/fixture_copy_bytes","id":"fixture-c-v0@0/fixture_copy_bytes","kind":"fixture-c-v0@0/owned_bytes","release":"fixture-c-v0@0/fixture_release_bytes"},{"category":"handle","create":"fixture-c-v0@0/fixture_open","id":"fixture-c-v0@0/fixture_open","kind":"fixture-c-v0@0/fixture_handle","release":"fixture-c-v0@0/fixture_close"}],"headerSha256":"6631016fa53f7fa5e58d1b7b74b2c0fbba576feb84d8321e5cfba589583398c5","id":"fixture-c-v0@0","kinds":["fixture-c-v0@0/fixture_handle","fixture-c-v0@0/owned_bytes"],"policySha256":"918edc899c9fff69bdc4b79d0cc8332af01f0e4b6b15f4778bf643809ce0dba8","version":"0"}],"operations":[{"direction":"import","effects":"total","execution":"sync-invoking-thread-no-retention-callback-reentry-concurrency-unwind","key":"fixture-c-v0@0/add","library":"fixture-c-v0@0","logicalName":"add","mode":"direct","parameters":[{"abi":"c-i32","name":"arg0","resource":null},{"abi":"c-i32","name":"arg1","resource":null}],"resources":[],"result":"c-i32","sourceBinding":{"end":103,"ordinal":0,"path":"tests/native-c-abi-v0/source-scalar.zry","sha256":"6ab8574ad7ce821bf6a3a3453527916710c228c47ce6d61917a84a63d79d8751","start":57},"statuses":[],"symbol":"add"},{"direction":"import","effects":"foreign","execution":"sync-invoking-thread-no-retention-callback-reentry-concurrency-unwind","key":"fixture-c-v0@0/fixture_close","library":"fixture-c-v0@0","logicalName":"fixture_close","mode":"void","parameters":[{"abi":"handle-in","name":"arg0","resource":0}],"resources":[{"access":"consume","allocator":"fixture-c-v0@0/fixture_open","borrowEnd":"none","encoding":"none","expectedLengthSlot":null,"fresh":false,"kind":"fixture-c-v0@0/fixture_handle","maxBytes":null,"nullRule":"nonnull","ownerAfter":"consumed","ownerBefore":"caller","releasableOnMalformed":false,"release":"fixture-c-v0@0/fixture_close","slots":[0],"validPointerGuarantee":true}],"result":"unit","sourceBinding":{"end":625,"ordinal":1,"path":"tests/native-c-abi-v0/source-handle.zry","sha256":"ec3f4420547328d343f538505ca6f956e8ea91456ffb4814b1dff60eeb8ea3f5","start":574},"statuses":[],"symbol":"fixture_close"},{"direction":"import","effects":"foreign","execution":"sync-invoking-thread-no-retention-callback-reentry-concurrency-unwind","key":"fixture-c-v0@0/fixture_copy_bytes","library":"fixture-c-v0@0","logicalName":"fixture_copy_bytes","mode":"status","parameters":[{"abi":"bytes-in","name":"arg0","resource":0},{"abi":"count","name":"arg1","resource":0},{"abi":"bytes-owned-out","name":"arg2","resource":1},{"abi":"count-out","name":"arg3","resource":1}],"resources":[{"access":"read","allocator":"none","borrowEnd":"return","encoding":"bytes","expectedLengthSlot":null,"fresh":false,"kind":"borrowed-bytes","maxBytes":4096,"nullRule":"null-zero","ownerAfter":"caller","ownerBefore":"caller","releasableOnMalformed":false,"release":"none","slots":[0,1],"validPointerGuarantee":true},{"access":"create","allocator":"fixture-c-v0@0/fixture_copy_bytes","borrowEnd":"none","encoding":"bytes","expectedLengthSlot":1,"fresh":true,"kind":"fixture-c-v0@0/owned_bytes","maxBytes":4096,"nullRule":"null-zero","ownerAfter":"caller","ownerBefore":"none","releasableOnMalformed":true,"release":"fixture-c-v0@0/fixture_release_bytes","slots":[2,3],"validPointerGuarantee":true}],"result":"c-i32","sourceBinding":{"end":963,"ordinal":2,"path":"tests/native-c-abi-v0/source-buffer.zry","sha256":"80df8f6acd406df211151547a5311ab13585fd0cd8b05cf16e794c428595fd42","start":874},"statuses":[{"code":0,"condition":"success","initialized":[2,3],"kind":"success","newOwners":[1],"preservesInputs":true},{"code":1,"condition":"raw-over-limit-or-allocation","initialized":[],"kind":"recoverable","newOwners":[],"preservesInputs":true}],"symbol":"fixture_copy_bytes"},{"direction":"import","effects":"foreign","execution":"sync-invoking-thread-no-retention-callback-reentry-concurrency-unwind","key":"fixture-c-v0@0/fixture_open","library":"fixture-c-v0@0","logicalName":"fixture_open","mode":"status","parameters":[{"abi":"c-i32","name":"arg0","resource":null},{"abi":"handle-out","name":"arg1","resource":0}],"resources":[{"access":"create","allocator":"fixture-c-v0@0/fixture_open","borrowEnd":"none","encoding":"none","expectedLengthSlot":null,"fresh":true,"kind":"fixture-c-v0@0/fixture_handle","maxBytes":null,"nullRule":"nonnull","ownerAfter":"caller","ownerBefore":"none","releasableOnMalformed":true,"release":"fixture-c-v0@0/fixture_close","slots":[1],"validPointerGuarantee":true}],"result":"c-i32","sourceBinding":{"end":187,"ordinal":3,"path":"tests/native-c-abi-v0/source-handle.zry","sha256":"ec3f4420547328d343f538505ca6f956e8ea91456ffb4814b1dff60eeb8ea3f5","start":134},"statuses":[{"code":0,"condition":"success","initialized":[1],"kind":"success","newOwners":[0],"preservesInputs":true},{"code":1,"condition":"negative-first-i32","initialized":[],"kind":"recoverable","newOwners":[],"preservesInputs":true},{"code":2,"condition":"allocation-failure","initialized":[],"kind":"recoverable","newOwners":[],"preservesInputs":true}],"symbol":"fixture_open"},{"direction":"import","effects":"foreign","execution":"sync-invoking-thread-no-retention-callback-reentry-concurrency-unwind","key":"fixture-c-v0@0/fixture_read","library":"fixture-c-v0@0","logicalName":"fixture_read","mode":"status","parameters":[{"abi":"handle-in","name":"arg0","resource":0},{"abi":"i32-out","name":"arg1","resource":null}],"resources":[{"access":"read","allocator":"fixture-c-v0@0/fixture_open","borrowEnd":"return","encoding":"none","expectedLengthSlot":null,"fresh":false,"kind":"fixture-c-v0@0/fixture_handle","maxBytes":null,"nullRule":"nonnull","ownerAfter":"caller","ownerBefore":"caller","releasableOnMalformed":false,"release":"fixture-c-v0@0/fixture_close","slots":[0],"validPointerGuarantee":true}],"result":"c-i32","sourceBinding":{"end":444,"ordinal":4,"path":"tests/native-c-abi-v0/source-handle.zry","sha256":"ec3f4420547328d343f538505ca6f956e8ea91456ffb4814b1dff60eeb8ea3f5","start":387},"statuses":[{"code":0,"condition":"success","initialized":[1],"kind":"success","newOwners":[],"preservesInputs":true}],"symbol":"fixture_read"},{"direction":"import","effects":"foreign","execution":"sync-invoking-thread-no-retention-callback-reentry-concurrency-unwind","key":"fixture-c-v0@0/fixture_release_bytes","library":"fixture-c-v0@0","logicalName":"fixture_release_bytes","mode":"void","parameters":[{"abi":"bytes-release","name":"arg0","resource":0}],"resources":[{"access":"consume","allocator":"fixture-c-v0@0/fixture_copy_bytes","borrowEnd":"none","encoding":"bytes","expectedLengthSlot":null,"fresh":false,"kind":"fixture-c-v0@0/owned_bytes","maxBytes":4096,"nullRule":"nonnull","ownerAfter":"consumed","ownerBefore":"caller","releasableOnMalformed":false,"release":"fixture-c-v0@0/fixture_release_bytes","slots":[0],"validPointerGuarantee":true}],"result":"unit","sourceBinding":{"end":1232,"ordinal":5,"path":"tests/native-c-abi-v0/source-buffer.zry","sha256":"80df8f6acd406df211151547a5311ab13585fd0cd8b05cf16e794c428595fd42","start":1172},"statuses":[],"symbol":"fixture_release_bytes"},{"direction":"import","effects":"foreign","execution":"sync-invoking-thread-no-retention-callback-reentry-concurrency-unwind","key":"fixture-c-v0@0/sum_bytes","library":"fixture-c-v0@0","logicalName":"sum_bytes","mode":"status","parameters":[{"abi":"bytes-in","name":"arg0","resource":0},{"abi":"count","name":"arg1","resource":0},{"abi":"i32-out","name":"arg2","resource":null}],"resources":[{"access":"read","allocator":"none","borrowEnd":"return","encoding":"bytes","expectedLengthSlot":null,"fresh":false,"kind":"borrowed-bytes","maxBytes":4096,"nullRule":"null-zero","ownerAfter":"caller","ownerBefore":"caller","releasableOnMalformed":false,"release":"none","slots":[0,1],"validPointerGuarantee":true}],"result":"c-i32","sourceBinding":{"end":219,"ordinal":6,"path":"tests/native-c-abi-v0/source-buffer.zry","sha256":"80df8f6acd406df211151547a5311ab13585fd0cd8b05cf16e794c428595fd42","start":147},"statuses":[{"code":0,"condition":"success","initialized":[2],"kind":"success","newOwners":[],"preservesInputs":true},{"code":1,"condition":"raw-over-limit","initialized":[],"kind":"recoverable","newOwners":[],"preservesInputs":true}],"symbol":"sum_bytes"},{"direction":"export","effects":"total","execution":"sync-invoking-thread-no-retention-callback-reentry-concurrency-unwind","key":"fixture-output/add","library":"fixture-output","logicalName":"add","mode":"direct","parameters":[{"abi":"c-i32","name":"left","resource":null},{"abi":"c-i32","name":"right","resource":null}],"resources":[],"result":"c-i32","sourceBinding":{"end":181,"ordinal":7,"path":"tests/native-c-abi-v0/source-scalar.zry","sha256":"6ab8574ad7ce821bf6a3a3453527916710c228c47ce6d61917a84a63d79d8751","start":107},"statuses":[],"symbol":"zryna_c_v0_e_add"}],"ownership":"native-c-interop-v0-resources","runtimeContract":"zryna-ownership-runtime-v1","sites":[{"end":84,"operation":null,"path":"tests/native-c-abi-v0/source-buffer.zry","primitive":"borrowBytes","safety":"safe","sourceSha256":"80df8f6acd406df211151547a5311ab13585fd0cd8b05cf16e794c428595fd42","spelling":"Ffi.borrowBytes(bytes)","start":62},{"end":123,"operation":null,"path":"tests/native-c-abi-v0/source-buffer.zry","primitive":"outI32","safety":"safe","sourceSha256":"80df8f6acd406df211151547a5311ab13585fd0cd8b05cf16e794c428595fd42","spelling":"Ffi.outI32()","start":111},{"end":219,"operation":"fixture-c-v0@0/sum_bytes","path":"tests/native-c-abi-v0/source-buffer.zry","primitive":"rawCall","safety":"unsafe-raw","sourceSha256":"80df8f6acd406df211151547a5311ab13585fd0cd8b05cf16e794c428595fd42","spelling":"Ffi.rawCall(\"fixture-c-v0@0/sum_bytes\", loan, Ffi.byteLength(loan), out)","start":147},{"end":213,"operation":null,"path":"tests/native-c-abi-v0/source-buffer.zry"